{
  "contract": "steerrunner-progress-file/v1",
  "run_id": "e3e7faea81da87b0e0d19b16aad80d76",
  "version": 3,
  "observed_at": "2026-10-23T12:42:34.158188Z",
  "encoding": "base64",
  "content_base64": "Y29wcGVyfGM6XHNydFwzZGIwODQxNTVmYTdcc1x3b3Jrc3BhY2VzXDN3dmI1M3pna3E3Y2RoY3psamkyN2xxbnpxXC5zdGVlcnJ1bm5lclxwcm9ncmVzc1xlM2U3ZmFlYTgxZGE4N2IwZTBkMTliMTZhYWQ4MGQ3Nlxwcm9ncmVzcy5iaW4A/xE=",
  "size_bytes": 137,
  "sha256": "6b180bd591c4a87800b9b68041347db7566eb2dc6b9ba3dae2479a30e825267c",
  "collection_status": "unavailable",
  "diagnostic": "file_missing"
}